{
  "case_id": "BLS-EXAMPLE-001",
  "standard": "СП 16.13330.2017",
  "action": "bending_member_local_stability",
  "moment_n_mm": 300000000,
  "shear_force_n": 250000,
  "distance_from_neutral_axis_mm": 500,
  "major_inertia_mm4": 1500000000,
  "web_thickness_mm": 12,
  "full_web_height_mm": 1000,
  "effective_web_height_mm": 960,
  "panel_length_mm": 960,
  "design_yield_resistance_n_mm2": 355,
  "design_shear_resistance_n_mm2": 205,
  "elastic_modulus_n_mm2": 206000,
  "working_condition_factor": 1.0,
  "local_stress_n_mm2": 40,
  "flange_width_mm": 320,
  "flange_thickness_mm": 24,
  "beta_factor": 0.75,
  "table_14_rho": 0.20,
  "table_14_panel_ratio": 1.0,
  "table_15_delta": 4.0,
  "table_15_panel_ratio": 1.0,
  "flange_outstand_mm": 140,
  "flange_design_yield_resistance_n_mm2": 355,
  "compressed_flange_stress_n_mm2": 220,
  "section_class": 1
}
